{
  "class_id": "SAC-0001",
  "version": "v1",
  "action": "roll back the last release of one service",
  "trigger": "error-rate alert record",
  "actors": [
    "TenCELL-OPSB"
  ],
  "targets": [
    "service A"
  ],
  "decision_types": [
    "restore-or-rollback"
  ],
  "reversible": true,
  "envelope": {
    "blast_cap": "one service",
    "budget": "3 uses a day",
    "staged_exposure": "none",
    "time_box": "PT30M",
    "dead_man": "PT15M"
  },
  "digest": "sha256:aaaaaaaaaaaaaaaaaaaaaaaaaaaaaaaaaaaaaaaaaaaaaaaaaaaaaaaaaaaaaaaa",
  "signature_ref": "SIG-0101"
}
